[
  {
    "label": "Debug selected test",
    "adapter": "sol-dap",
    "request": "launch",
    "project_root": "$ZED_WORKTREE_ROOT/tests/fixtures/sample-project",
    "test": "$ZED_SELECTED_TEXT"
  },
  {
    "label": "Debug: testIncrement",
    "adapter": "sol-dap",
    "request": "launch",
    "project_root": "$ZED_WORKTREE_ROOT/tests/fixtures/sample-project",
    "test": "testIncrement",
    "contract": "CounterTest"
  },
  {
    "label": "Debug: testSetNumber",
    "adapter": "sol-dap",
    "request": "launch",
    "project_root": "$ZED_WORKTREE_ROOT/tests/fixtures/sample-project",
    "test": "testSetNumber",
    "contract": "CounterTest"
  }
]
